{
  "schemaVersion": "1.0",
  "kind": "loopengineer.channelEvent",
  "event_id": "channel-event-19-grant",
  "event_type": "grant",
  "version": {
    "productVersion": "0.1.0",
    "protocolVersion": "1",
    "schemaVersion": "1.0",
    "skillContractVersion": "1"
  },
  "channel_id": "channel-contract",
  "scheduler_id": "scheduler-19",
  "unit_id": "unit-channel-schema",
  "created_at": "2026-06-15T09:30:00Z",
  "requested_paths": [
    "schemas/v1/channel-state.schema.json"
  ],
  "granted_paths": [
    "schemas/v1/channel-state.schema.json"
  ],
  "grant_scope": "schema contract files for issue #19 only",
  "current_pr": "#69",
  "current_head": "1234567890abcdef",
  "current_base": "abcdef1234567890",
  "release_predicate": "PR checks pass and no other scheduler owns contract paths.",
  "required_report_after_action": "channel release report with validation evidence",
  "next_action": {
    "owner": "scheduler",
    "action": "perform granted schema work and report release evidence",
    "status": "required"
  }
}
